{
  "$schema": "./data-processing-inventory.schema.json",
  "schemaVersion": 1,
  "reviewedAt": "2026-08-01",
  "productionApproved": false,
  "controllerIdentity": "Pending verified operator details",
  "defaultRegionPolicy": "Deployment controlled; no Cloud production region has been selected.",
  "coverage": {
    "identity": true,
    "billing": true,
    "documents": true,
    "workers": true,
    "mail": true,
    "telemetry": true,
    "logs": true,
    "browserStorage": true,
    "providers": true,
    "regions": true,
    "transfers": true,
    "retention": true
  },
  "activities": [
    {
      "id": "identity-and-authentication",
      "name": "Account identity, authentication, and sessions",
      "role": "controller",
      "purposes": ["Create and secure accounts", "Authenticate browser and API access", "Verify email and recover access"],
      "dataSubjects": ["registered users", "invited users", "service-account administrators"],
      "dataCategories": ["name", "email", "locale and country", "password hash", "security state", "session metadata", "hashed action tokens", "API-key metadata"],
      "systems": ["PostgreSQL", "ASP.NET Core Identity", "host-only security cookies"],
      "entities": ["IdentityActionToken", "UserSession", "DesignerAuthorizationCode", "ServiceAccount", "ApiKey", "UserConsentEvent"],
      "providerIds": ["postgresql"],
      "region": "PVAD Server deployment region",
      "transfer": "none-by-default",
      "retention": {
        "status": "legal-review-required",
        "approvalStatus": "pending-legal",
        "rule": "Session and action-token expiry is enforced, but final account, credential-metadata, and consent-evidence deletion periods are not approved.",
        "legalApprovalRequired": true
      },
      "sources": ["PVAD.WebApi/Program.cs", "PVAD.WebApi/Security/PvadSessionService.cs", "src/Infrastructure/PVAD.Infrastructure.Persistence/PvadDbContext.cs"]
    },
    {
      "id": "organizations-and-access",
      "name": "Organizations, memberships, roles, and permissions",
      "role": "controller",
      "purposes": ["Provide tenant workspaces", "Authorize organization operations", "Administer users and seats"],
      "dataSubjects": ["organization members", "organization administrators"],
      "dataCategories": ["organization identity", "membership status", "role and permission assignments", "administrative timestamps"],
      "systems": ["PostgreSQL", "PVAD Account", "PVAD Admin"],
      "entities": ["Organization", "OrganizationMembership", "OrganizationMembershipRole"],
      "providerIds": ["postgresql"],
      "region": "PVAD Server deployment region",
      "transfer": "none-by-default",
      "retention": {
        "status": "legal-review-required",
        "approvalStatus": "pending-legal",
        "rule": "Closed organizations are retained; deletion, anonymization, and legal-hold periods require approval.",
        "legalApprovalRequired": true
      },
      "sources": ["PVAD.WebApi/Application/Organizations/OrganizationMembershipService.cs", "src/Infrastructure/PVAD.Infrastructure.Persistence/PvadDbContext.cs"]
    },
    {
      "id": "subscriptions-usage-and-licensing",
      "name": "Subscriptions, entitlements, usage, seats, and offline licenses",
      "role": "controller",
      "purposes": ["Deliver subscribed products", "Enforce quotas and seats", "Manage Trial and license lifecycle", "Prepare future billing integration"],
      "dataSubjects": ["subscribers", "organization members", "billing contacts"],
      "dataCategories": ["subscription edition and state", "seat assignment", "product entitlements", "aggregated usage events", "license identifiers and validity", "lifecycle history"],
      "systems": ["PostgreSQL", "PVAD API", "PVAD Admin"],
      "entities": ["OrganizationSubscription", "SubscriptionEntitlement", "SubscriptionSeatAssignment", "SubscriptionLifecycleEvent", "SubscriptionUsageEvent", "OfflineLicense"],
      "providerIds": ["postgresql"],
      "region": "PVAD Server deployment region",
      "transfer": "none-by-default; a future payment provider requires a reviewed processor entry before activation",
      "retention": {
        "status": "legal-review-required",
        "approvalStatus": "pending-legal",
        "rule": "Commercial and tax retention periods are not yet approved; no payment-card data is currently processed by PVAD.",
        "legalApprovalRequired": true
      },
      "sources": ["PVAD.WebApi/Services/Entitlements/PvadUsageService.cs", "PVAD.WebApi/Application/Subscriptions/SubscriptionQueryService.cs", "src/Infrastructure/PVAD.Infrastructure.Persistence/PvadDbContext.cs"]
    },
    {
      "id": "designer-content",
      "name": "Designer templates, versions, preferences, releases, and notifications",
      "role": "processor-for-customer-content",
      "purposes": ["Create and save document templates", "Publish immutable template versions", "Apply feature preferences", "Deliver product notifications"],
      "dataSubjects": ["template authors", "document subjects whose data users place in templates"],
      "dataCategories": ["template metadata", "design JSON", "customer-entered document content", "feature preferences", "release read state", "notification state"],
      "systems": ["PostgreSQL", "PVAD Designer"],
      "entities": ["DesignerTemplate", "DesignerTemplateVersion", "DesignerCodeWorkspace", "DesignerCodeWorkspaceVersion", "DesignerElementFavorite", "DesignerFeaturePreference", "DesignerFeaturePolicy", "DesignerReleaseRead", "DesignerNotification", "DesignerNotificationState"],
      "providerIds": ["postgresql", "browser-storage"],
      "region": "PVAD Server deployment region and the user's browser for disclosed local working state",
      "transfer": "none-by-default",
      "retention": {
        "status": "legal-review-required",
        "approvalStatus": "pending-legal",
        "rule": "Templates support soft deletion and tenant-state clearing, but archive, purge, and account-closure periods require approval.",
        "legalApprovalRequired": true
      },
      "sources": ["PVAD.WebApi/Controllers/DesignerTemplatesController.cs", "src/Infrastructure/PVAD.Infrastructure.Persistence/PvadDbContext.cs", "product-metadata/browser-storage.json"]
    },
    {
      "id": "synchronous-document-processing",
      "name": "Synchronous generation, conversion, migration, import, export, OCR, and analysis",
      "role": "processor-for-customer-content",
      "purposes": ["Perform the document operation requested by the customer", "Return generated or transformed output", "Diagnose operation failures without logging document bodies"],
      "dataSubjects": ["API users", "persons represented in customer documents"],
      "dataCategories": ["uploaded documents", "source code", "template JSON", "images", "OCR text", "generated outputs", "operation metadata"],
      "systems": ["PVAD WebApi process memory", "local temporary files", "in-process PVAD and third-party document libraries", "local OCR worker"],
      "entities": [],
      "providerIds": ["local-ocr", "embedded-document-libraries"],
      "region": "PVAD Server execution region",
      "transfer": "none-by-default; document libraries execute locally and are not configured as network recipients",
      "retention": {
        "status": "transient",
        "approvalStatus": "approved",
        "rule": "Request content and temporary files are processed for the operation and released or deleted when it completes; application logs must not contain document bodies.",
        "legalApprovalRequired": false
      },
      "sources": ["PVAD.WebApi/Controllers/DocumentOpsController.cs", "PVAD.WebApi/Controllers/ExportController.cs", "PVAD.WebApi/Controllers/MigrationController.cs", "PVAD.WebApi/Services/Storage/PvadStoredObjectService.cs"]
    },
    {
      "id": "background-document-jobs",
      "name": "Queued document operations and stored input or result objects",
      "role": "processor-for-customer-content",
      "purposes": ["Execute long-running document operations", "Permit status polling and result download", "Retry bounded failures"],
      "dataSubjects": ["API users", "persons represented in customer documents"],
      "dataCategories": ["job metadata", "organization and creator identifiers", "uploaded input objects", "generated result objects", "trace correlation", "failure summary"],
      "systems": ["PostgreSQL", "configured object storage", "PVAD background workers"],
      "entities": ["PvadBackgroundJob", "PvadStoredObject", "PdfTrustOperationJob", "EInvoiceValidationRecord"],
      "providerIds": ["postgresql", "filesystem-object-storage"],
      "region": "PVAD Server and object-storage deployment region",
      "transfer": "none-by-default",
      "retention": {
        "status": "enforced",
        "approvalStatus": "pending-legal",
        "rule": "Transient jobs are the default: input and result content is purged after successful result download or no later than 24 hours after terminal completion. Explicit Retained jobs keep content for seven days. Payloads and diagnostics are scrubbed with content, and minimized terminal job metadata expires after 30 days. Active Legal Holds suspend both cleanup stages.",
        "configuration": ["Jobs:TransientRetentionHours", "Jobs:ResultRetentionDays", "Jobs:TerminalMetadataRetentionDays", "Jobs:CleanupIntervalMinutes"],
        "legalApprovalRequired": true
      },
      "sources": ["PVAD.WebApi/Controllers/DocumentJobsController.cs", "PVAD.WebApi/Controllers/JobsController.cs", "PVAD.WebApi/Services/Jobs/PvadJobOptions.cs", "PVAD.WebApi/Services/Jobs/PvadJobRetentionService.cs", "PVAD.WebApi/Services/Storage/PvadStoredObjectService.cs"]
    },
    {
      "id": "transactional-mail",
      "name": "Transactional email queue and delivery",
      "role": "controller",